"@RichardGarriott Just the air in Dragon. Technically, if a few humans had stowed aboard Dragon on the last flight, they would've been ok."
"@westcoastbill First, the cheese. Then, the mouse."
The next Dragon mission to the Space Station will carry our first live mammals: 40 mousetronauts! http://t.co/rR3c6gd1v3
Contracting official's new job raises questions http://t.co/JhRDGa6vYZ
"Either way, this case certainly deserves close examination by the DoD Inspector General per @SenJohnMcCain's request http://t.co/IZ4JO2y3JO"
"Reason I believe this is likely is that Correll first tried to work at SpaceX, but we turned him down. Our competitor, it seems, did not."
V likely AF official Correll was told by ULA/Rocketdyne that a rich VP job was his if he gave them a sole source contract
Air Force official awards $10B+ contract uncompeted &amp; then takes lucrative job w funds recipient http://t.co/SHqFYWd3CR
